{
  "$schema": "http://json-schema.org/draft-07/schema#",
  "title": "SUC Workout",
  "description": "Canonical workout object.",
  "type": "object",
  "required": ["id", "title", "status", "createdAt", "updatedAt", "type", "description"],
  "properties": {
    "id": { "type": "string", "minLength": 1 },
    "title": { "type": "string", "minLength": 1 },
    "description": { "type": "string" },
    "tags": { "type": "array", "items": { "type": "string" } },
    "status": { "type": "string", "enum": ["draft", "published"] },
    "createdAt": { "type": "string", "format": "date-time" },
    "updatedAt": { "type": "string", "format": "date-time" },
    "type": { "type": "string", "minLength": 1 },
    "duration": { "type": "number", "minimum": 0 },
    "distance": { "type": "number", "minimum": 0 },
    "routeId": { "type": "string", "minLength": 1 },
    "routeMode": { "type": "string", "enum": ["fixed-sections"] },
    "sectionEfforts": {
      "type": "array",
      "items": {
        "type": "object",
        "required": ["sectionKey", "effort"],
        "properties": {
          "sectionKey": { "type": "string", "minLength": 1 },
          "effort": { "type": "string", "minLength": 1 }
        },
        "additionalProperties": false
      }
    },
    "steps": {
      "type": "array",
      "items": {
        "type": "object",
        "required": ["label", "details"],
        "properties": {
          "label": { "type": "string", "minLength": 1 },
          "details": { "type": "string", "minLength": 1 }
        },
        "additionalProperties": false
      }
    }
  },
  "additionalProperties": false
}
