{
  "id": "workout-f87c7cf1-1ffb-411f-9773-9e50c9145339",
  "title": "Aerobic Builder",
  "description": "Aerobic base building run. The goal is to keep a steady pace that feels relaxed and smooth. Practice fueling and even pacing.\n\nBreathing is conversational, but its not an easy run. This effort falls between easy and tempo. Steady.",
  "tags": [
    "aerobic",
    "easy",
    "daily"
  ],
  "status": "published",
  "createdAt": "2026-02-07T07:47:02.142Z",
  "updatedAt": "2026-02-07T07:47:02.142Z",
  "type": "run"
}
