{
  "id": "workout-578db8ec-e939-4782-9ba1-2793747072f2",
  "title": "Aerobic Rollers",
  "description": "Aerobic base building run. The goal is to keep a steady pace that feels relaxed and smooth.\n\nRun on a rolling road or trail, with significant vert and try to push on the downhills while keeping HR low on uphills.\n\nBreathing is conversational, but its not an easy run. This effort falls between easy and tempo. Steady.",
  "tags": [],
  "status": "published",
  "createdAt": "2026-02-07T07:47:02.142Z",
  "updatedAt": "2026-02-07T07:47:02.142Z",
  "type": "run"
}
