{
  "id": "workout-3edf7e98-add7-4dc7-a7a5-b6273d7d5b50",
  "title": "Mixed Intervals - 30s + 2min",
  "description": "This mixed interval workout has some fast, interval effort on the front and tail end, with some steady threshold efforts in between.\n\nThis workout is intended to be run hard in the middle. The last set of 30 second reps is time to let loose.",
  "tags": [
    "mixed",
    "combo",
    "intervals"
  ],
  "status": "published",
  "createdAt": "2026-02-07T07:47:02.142Z",
  "updatedAt": "2026-02-07T07:47:02.142Z",
  "type": "run"
}
