{
  "id": "workout-318f134e-b31a-453e-b74e-c33204927a03",
  "title": "Uphill / Roller / Downhill Threshold",
  "description": "",
  "tags": [
    "threshold",
    "trail",
    "tempo"
  ],
  "status": "published",
  "createdAt": "2026-02-28T06:19:13.052Z",
  "updatedAt": "2026-02-28T06:19:13.052Z",
  "type": "run"
}
