{
  "id": "workout-f0a00c03-b742-45c9-acd0-1de9aedc3f43",
  "title": "Aerobic Maintenance",
  "description": "Aerobic maintenance, to maintain aerobic gains without taxing the system. The goal is to keep a steady pace that feels relaxed and smooth.\n\nBreathing is conversational, but its not an easy run. This effort falls between easy and tempo. Steady.",
  "tags": [
    "aerobic",
    "daily"
  ],
  "status": "published",
  "createdAt": "2026-02-07T07:47:02.142Z",
  "updatedAt": "2026-02-07T07:47:02.142Z",
  "type": "run"
}
