{
  "id": "workout-27b78894-65c5-462e-bbd7-759775e204e1",
  "title": "Vert Heavy Trail Run",
  "description": "Head out for a longer, steady-paced trail run. Focus on maintaining a consistent, comfortable effort throughout the run.\n\nAim for 3k+ feet of climbing on terrain that is similar or steeper than your goal race.\n\nThis run is key to building the stamina and strength you'll need for your upcoming trail race. Remember to bring hydration and fuel to keep your energy levels stable throughout.",
  "tags": [
    "vert",
    "trail",
    "long-run"
  ],
  "status": "published",
  "createdAt": "2026-02-07T07:47:02.142Z",
  "updatedAt": "2026-02-07T07:47:02.142Z",
  "type": "run"
}
