{
  "id": "workout-72dcf2a8-506e-4c9e-94ed-e783e57b9bd8",
  "title": "Strides",
  "description": "Easy aerobic effort with short strides at the end to turn the legs over.\n\nStay strictly in Z2 for the main run (RPE 4–5). Add 4–6 strides near the end — 20–30 seconds at quick, relaxed effort with full recovery. These aren’t sprints. Smooth, powerful, and under control.",
  "tags": [
    "strides",
    "easy",
    "daily"
  ],
  "status": "published",
  "createdAt": "2026-02-07T07:47:02.142Z",
  "updatedAt": "2026-02-07T07:47:02.142Z",
  "type": "run"
}
