{
  "id": "workout-247bdf6e-8207-4707-810e-87b210cecbbc",
  "title": "Strength Day Shakeout",
  "description": "An easy shakeout before or after your mobility workout. Purpose is to loosen up the legs and get ready for your next big workout.",
  "tags": [
    "easy",
    "recovery",
    "daily"
  ],
  "status": "published",
  "createdAt": "2026-02-07T07:47:02.142Z",
  "updatedAt": "2026-02-07T07:47:02.142Z",
  "type": "run"
}
