{
  "id": "workout-6858b433-0fd5-4e85-b928-1c585d9dee79",
  "title": "Race Day - Salmon Falls",
  "description": "",
  "tags": [
    "race",
    "ultra",
    "trail"
  ],
  "status": "published",
  "createdAt": "2026-02-28T06:54:07.952Z",
  "updatedAt": "2026-02-28T06:54:07.952Z",
  "type": "run"
}
