{
  "id": "workout-b481028e-180a-4f8b-a737-a1203354c535",
  "title": "Evening Double",
  "description": "Aerobic base building run. The goal is to keep a steady pace that feels relaxed and smooth. Practice fueling and even pacing.\n\nBreathing is conversational, but its not an easy run. This effort falls between easy and tempo. Steady.",
  "tags": [
    "recovery",
    "daily",
    "double"
  ],
  "status": "published",
  "createdAt": "2026-02-07T07:47:02.142Z",
  "updatedAt": "2026-02-07T07:47:02.142Z",
  "type": "run"
}
