{
  "id": "workout-85df3b96-5453-49ee-9b09-2e387bfcf638",
  "title": "1-2-3-4-5 Ladder",
  "description": "Up and down the ladder. Shifting gears and testing different systems. This workout will challenge your pacing discipline.",
  "tags": [
    "ladder",
    "intervals",
    "threshold"
  ],
  "status": "published",
  "createdAt": "2026-02-28T06:19:13.052Z",
  "updatedAt": "2026-02-28T06:19:13.052Z",
  "type": "run"
}
