{
  "id": "workout-1869e82a-1ddd-4c6b-a75b-669a2062d0b1",
  "title": "Explosiveness + Power",
  "description": "Mixed strength workout hitting some fast twitch muscles and some heavier lifting.\n\nFocused on legs, glutes and explosiveness.",
  "tags": [],
  "status": "published",
  "createdAt": "2026-02-07T07:47:02.142Z",
  "updatedAt": "2026-02-07T07:47:02.142Z",
  "type": "run"
}
