{
  "id": "workout-beb63419-1369-4f69-9254-b5b4f4404d28",
  "title": "Back-to-Back",
  "description": "Head out for a longer, steady-paced trail run. Focus on maintaining a consistent, comfortable effort throughout the run.\n\nNo need to push pace, focus on fueling and positive mindset. Enjoy a low pressure day on the trails.. with tried legs.\n\nThis run is key to building the stamina and strength you'll need for your upcoming trail race. Remember to bring hydration and fuel to keep your energy levels stable throughout.",
  "tags": [
    "back-to-back",
    "long-run",
    "trail"
  ],
  "status": "published",
  "createdAt": "2026-02-07T07:47:02.142Z",
  "updatedAt": "2026-02-07T07:47:02.142Z",
  "type": "run"
}
