{
  "id": "workout-d6b52256-00dd-4b11-a533-341f26fa1f41",
  "title": "XL Trail Run",
  "description": "One simple goal. Get time on feet. Adapt to the terrain and work with the trail.",
  "tags": [],
  "status": "published",
  "createdAt": "2026-02-28T06:19:13.052Z",
  "updatedAt": "2026-02-28T06:19:13.052Z",
  "type": "run"
}
