{
  "id": "workout-ac6e6480-965e-4182-b05f-19f6113c4f88",
  "title": "Threshold 90s + Tempo",
  "description": "A mixed interval + tempo workout that challenges you to sustain your speed on fatigued and tired legs. Focus on a steady but fast pace for the tempo effort.",
  "tags": [
    "Threshold",
    "Tempo",
    "Combo"
  ],
  "status": "published",
  "createdAt": "2026-02-06T21:01:44.629Z",
  "updatedAt": "2026-02-06T21:01:44.629Z",
  "type": "run"
}
