{
  "id": "workout-8d07bc2c-ddab-4687-938a-d1617369b5d4",
  "title": "Mixed Intervals 45s / 3\" / 8\"",
  "description": "45 second extended strides into 3 min threshold and 8 min tempo intervals. This workout will activate your stride early and help your cruise through the longer intervals.",
  "tags": [
    "mixed",
    "intervals",
    "threshold"
  ],
  "status": "published",
  "createdAt": "2026-02-28T06:19:13.052Z",
  "updatedAt": "2026-02-28T06:19:13.052Z",
  "type": "run"
}
